Speaker,Sentence
KING EDWARD IV,"Have a tongue to doom my brother's death,
And shall the same give pardon to a slave?
My brother slew no man; his fault was thought,
And yet his punishment was cruel death.
Who sued to me for him? who, in my rage,
Kneel'd at my feet, and bade me be advised
Who spake of brotherhood? who spake of love?
Who told me how the poor soul did forsake
The mighty Warwick, and did fight for me?
Who told me, in the field by Tewksbury
When Oxford had me down, he rescued me,
And said, 'Dear brother, live, and be a king'?
Who told me, when we both lay in the field
Frozen almost to death, how he did lap me
Even in his own garments, and gave himself,
All thin and naked, to the numb cold night?
All this from my remembrance brutish wrath
Sinfully pluck'd, and not a man of you
Had so much grace to put it in my mind.
But when your carters or your waiting-vassals
Have done a drunken slaughter, and defaced
The precious image of our dear Redeemer,
You straight are on your knees for pardon, pardon;
And I unjustly too, must grant it you
But for my brother not a man would speak,
Nor I, ungracious, speak unto myself
For him, poor soul. The proudest of you all
Have been beholding to him in his life;
Yet none of you would once plead for his life.
O God, I fear thy justice will take hold
On me, and you, and mine, and yours for this!
Come, Hastings, help me to my closet.
Oh, poor Clarence!"
GLOUCESTER,"This is the fruit of rashness! Mark'd you not
How that the guilty kindred of the queen
Look'd pale when they did hear of Clarence' death?
O, they did urge it still unto the king!
God will revenge it. But come, let us in,
To comfort Edward with our company."
BUCKINGHAM,We wait upon your grace.
DUCHESS OF YORK,"No, boy."
DUCHESS OF YORK,"My pretty cousins, you mistake me much;
I do lament the sickness of the king.
As loath to lose him, not your father's death;
It were lost sorrow to wail one that's lost."
DUCHESS OF YORK,"Peace, children, peace! the king doth love you well"
DUCHESS OF YORK,"Oh, that deceit should steal such gentle shapes,
And with a virtuous vizard hide foul guile!
He is my son; yea, and therein my shame;
Yet from my dugs he drew not this deceit."
DUCHESS OF YORK,"Ay, boy."
QUEEN ELIZABETH,"Oh, who shall hinder me to wail and weep,
To chide my fortune, and torment myself?
I'll join with black despair against my soul,
And to myself become an enemy."
DUCHESS OF YORK,What means this scene of rude impatience?
QUEEN ELIZABETH,To make an act of tragic violence
DUCHESS OF YORK,"Ah, so much interest have I in thy sorrow
As I had title in thy noble husband!
I have bewept a worthy husband's death,
And lived by looking on his images"
QUEEN ELIZABETH,"Give me no help in lamentation;
I am not barren to bring forth complaints
All springs reduce their currents to mine eyes,
That I, being govern'd by the watery moon,
May send forth plenteous tears to drown the world!
Oh for my husband, for my dear lord Edward!"
DUCHESS OF YORK,"Alas for both, both mine, Edward and Clarence!"
QUEEN ELIZABETH,What stay had I but Edward? and he's gone.
DUCHESS OF YORK,What stays had I but they? and they are gone.
QUEEN ELIZABETH,Was never widow had so dear a loss!
DUCHESS OF YORK,"Was never mother had so dear a loss!
Alas, I am the mother of these moans!
Their woes are parcell'd, mine are general.
She for an Edward weeps, and so do I;
I for a Clarence weep, so doth not she"
GLOUCESTER,"Madam, have comfort"
DUCHESS OF YORK,"God bless thee; and put meekness in thy mind,
Love, charity, obedience, and true duty!"
GLOUCESTER,""
BUCKINGHAM,"You cloudy princes and heart-sorrowing peers,
That bear this mutual heavy load of moan,
Now cheer each other in each other's love
Though we have spent our harvest of this king,
We are to reap the harvest of his son.
The broken rancour of your high-swoln hearts,
But lately splinter'd, knit, and join'd together,
Must gently be preserved, cherish'd, and kept"
BUCKINGHAM,"Marry, my lord, lest, by a multitude,
The new-heal'd wound of malice should break out,
Which would be so much the more dangerous
By how much the estate is green and yet ungovern'd"
GLOUCESTER,"I hope the king made peace with all of us
And the compact is firm and true in me."
GLOUCESTER,"Then be it so; and go we to determine
Who they shall be that straight shall post to Ludlow.
Madam, and you, my mother, will you go
To give your censures in this weighty business?"
QUEEN ELIZABETH,With all our harts.
BUCKINGHAM,"My lord, whoever journeys to the Prince,
For God's sake, let not us two be behind;
For, by the way, I'll sort occasion,
As index to the story we late talk'd of,
To part the queen's proud kindred from the king."
GLOUCESTER,"My other self, my counsel's consistory,
My oracle, my prophet! My dear cousin,
I, like a child, will go by thy direction.
Towards Ludlow then, for we'll not stay behind."
DUCHESS OF YORK,I long with all my heart to see the prince
QUEEN ELIZABETH,"But I hear, no; they say my son of York
Hath almost overta'en him in his growth."
DUCHESS OF YORK,"Why, my young cousin, it is good to grow."
DUCHESS OF YORK,"Good faith, good faith, the saying did not hold
In him that did object the same to thee;
He was the wretched'st thing when he was young,
So long a-growing and so leisurely,
That, if this rule were true, he should be gracious."
DUCHESS OF YORK,I hope he is; but yet let mothers doubt.
DUCHESS OF YORK,"How, my pretty York? I pray thee, let me hear it."
DUCHESS OF YORK,"I pray thee, pretty York, who told thee this?"
DUCHESS OF YORK,"His nurse! why, she was dead ere thou wert born."
QUEEN ELIZABETH,A parlous boy
QUEEN ELIZABETH,Pitchers have ears.
QUEEN ELIZABETH,How fares the prince?
DUCHESS OF YORK,What is thy news then?
DUCHESS OF YORK,Who hath committed them?
QUEEN ELIZABETH,For what offence?
QUEEN ELIZABETH,"Ay me, I see the downfall of our house!
The tiger now hath seized the gentle hind;
Insulting tyranny begins to jet
Upon the innocent and aweless throne"
DUCHESS OF YORK,"Accursed and unquiet wrangling days,
How many of you have mine eyes beheld!
My husband lost his life to get the crown;
And often up and down my sons were toss'd,
For me to joy and weep their gain and loss"
QUEEN ELIZABETH,"Come, come, my boy; we will to sanctuary.
Madam, farewell."
DUCHESS OF YORK,I'll go along with you.
QUEEN ELIZABETH,You have no cause.
BUCKINGHAM,"Welcome, sweet prince, to London, to your chamber."
GLOUCESTER,"Welcome, dear cousin, my thoughts' sovereign
The weary way hath made you melancholy."
GLOUCESTER,"Sweet prince, the untainted virtue of your years
Hath not yet dived into the world's deceit
Nor more can you distinguish of a man
Than of his outward show; which, God he knows,
Seldom or never jumpeth with the heart.
Those uncles which you want were dangerous;
Your grace attended to their sugar'd words,
But look'd not on the poison of their hearts "
GLOUCESTER,"My lord, the mayor of London comes to greet you."
BUCKINGHAM,"And, in good time, here comes the sweating lord."
BUCKINGHAM,"Fie, what an indirect and peevish course
Is this of hers! Lord cardinal, will your grace
Persuade the queen to send the Duke of York
Unto his princely brother presently?
If she deny, Lord Hastings, go with him,
And from her jealous arms pluck him perforce."
BUCKINGHAM,"You are too senseless--obstinate, my lord,
Too ceremonious and traditional
Weigh it but with the grossness of this age,
You break not sanctuary in seizing him.
The benefit thereof is always granted
To those whose dealings have deserved the place,
And those who have the wit to claim the place"
GLOUCESTER,"Where it seems best unto your royal self.
If I may counsel you, some day or two
Your highness shall repose you at the Tower"
BUCKINGHAM,"He did, my gracious lord, begin that place;
Which, since, succeeding ages have re-edified."
BUCKINGHAM,"Upon record, my gracious lord."
GLOUCESTER,""
GLOUCESTER,"I say, without characters, fame lives long.
Thus, like the formal vice, Iniquity,
I moralize two meanings in one word."
BUCKINGHAM,"What, my gracious lord?"
GLOUCESTER,""
BUCKINGHAM,"Now, in good time, here comes the Duke of York."
GLOUCESTER,"How fares our cousin, noble Lord of York?"
GLOUCESTER,"He hath, my lord."
GLOUCESTER,"O, my fair cousin, I must not say so."
GLOUCESTER,"He may command me as my sovereign;
But you have power in me as in a kinsman."
GLOUCESTER,"My dagger, little cousin? with all my heart."
GLOUCESTER,A greater gift than that I'll give my cousin.
GLOUCESTER,"A gentle cousin, were it light enough."
GLOUCESTER,It is too heavy for your grace to wear.
GLOUCESTER,"What, would you have my weapon, little lord?"
GLOUCESTER,How?
BUCKINGHAM,"With what a sharp-provided wit he reasons!
To mitigate the scorn he gives his uncle,
He prettily and aptly taunts himself"
GLOUCESTER,"My lord, will't please you pass along?
Myself and my good cousin Buckingham
Will to your mother, to entreat of her
To meet you at the Tower and welcome you."
GLOUCESTER,"Why, what should you fear?"
GLOUCESTER,"Nor none that live, I hope."
BUCKINGHAM,"Think you, my lord, this little prating York
Was not incensed by his subtle mother
To taunt and scorn you thus opprobriously?"
GLOUCESTER,"No doubt, no doubt; O, 'tis a parlous boy;
Bold, quick, ingenious, forward, capable
He is all the mother's, from the top to toe."
BUCKINGHAM,"Well, let them rest. Come hither, Catesby.
Thou art sworn as deeply to effect what we intend
As closely to conceal what we impart"
BUCKINGHAM,"What think'st thou, then, of Stanley? what will he?"
BUCKINGHAM,"Well, then, no more but this"
GLOUCESTER,Commend me to Lord William
BUCKINGHAM,"Good Catesby, go, effect this business soundly."
GLOUCESTER,"Shall we hear from you, Catesby, ere we sleep?"
GLOUCESTER,"At Crosby Place, there shall you find us both."
BUCKINGHAM,"Now, my lord, what shall we do, if we perceive
Lord Hastings will not yield to our complots?"
GLOUCESTER,"Chop off his head, man; somewhat we will do"
BUCKINGHAM,I'll claim that promise at your grace's hands.
GLOUCESTER,"And look to have it yielded with all willingness.
Come, let us sup betimes, that afterwards
We may digest our complots in some form."
BUCKINGHAM,"What, talking with a priest, lord chamberlain?
Your friends at Pomfret, they do need the priest;
Your honour hath no shriving work in hand."
BUCKINGHAM,"I do, my lord; but long I shall not stay
I shall return before your lordship thence."
BUCKINGHAM,""
BUCKINGHAM,Are all things fitting for that royal time?
BUCKINGHAM,"Who knows the lord protector's mind herein?
Who is most inward with the royal duke?"
BUCKINGHAM,"Who, I, my lord I we know each other's faces,
But for our hearts, he knows no more of mine,
Than I of yours;
Nor I no more of his, than you of mine.
Lord Hastings, you and he are near in love."
GLOUCESTER,"My noble lords and cousins all, good morrow.
I have been long a sleeper; but, I hope,
My absence doth neglect no great designs,
Which by my presence might have been concluded."
BUCKINGHAM,"Had not you come upon your cue, my lord
William Lord Hastings had pronounced your part,--
I mean, your voice,--for crowning of the king."
GLOUCESTER,"Than my Lord Hastings no man might be bolder;
His lordship knows me well, and loves me well."
GLOUCESTER,My lord of Ely!
GLOUCESTER,"When I was last in Holborn,
I saw good strawberries in your garden there
I do beseech you send for some of them."
GLOUCESTER,"Cousin of Buckingham, a word with you.
Catesby hath sounded Hastings in our business,
And finds the testy gentleman so hot,
As he will lose his head ere give consent
His master's son, as worshipful as he terms it,
Shall lose the royalty of England's throne."
BUCKINGHAM,"Withdraw you hence, my lord, I'll follow you."
GLOUCESTER,"I pray you all, tell me what they deserve
That do conspire my death with devilish plots
Of damned witchcraft, and that have prevail'd
Upon my body with their hellish charms?"
GLOUCESTER,Then be your eyes the witness of this ill
GLOUCESTER,"If I thou protector of this damned strumpet--
Tellest thou me of 'ifs'?  Thou art a traitor"
GLOUCESTER,"Come, cousin, canst thou quake, and change thy colour,
Murder thy breath in the middle of a word,
And then begin again, and stop again,
As if thou wert distraught and mad with terror?"
BUCKINGHAM,"Tut, I can counterfeit the deep tragedian;
Speak and look back, and pry on every side,
Tremble and start at wagging of a straw,
Intending deep suspicion"
GLOUCESTER,"He is; and, see, he brings the mayor along."
BUCKINGHAM,"Lord mayor,--"
GLOUCESTER,Look to the drawbridge there!
BUCKINGHAM,Hark! a drum.
GLOUCESTER,"Catesby, o'erlook the walls."
BUCKINGHAM,"Lord mayor, the reason we have sent--"
GLOUCESTER,"Look back, defend thee, here are enemies."
BUCKINGHAM,God and our innocency defend and guard us!
GLOUCESTER,"Be patient, they are friends, Ratcliff and Lovel."
GLOUCESTER,"So dear I loved the man, that I must weep.
I took him for the plainest harmless creature
That breathed upon this earth a Christian;
Made him my book wherein my soul recorded
The history of all her secret thoughts"
BUCKINGHAM,"Well, well, he was the covert'st shelter'd traitor
That ever lived.
Would you imagine, or almost believe,
Were't not that, by great preservation,
We live to tell it you, the subtle traitor
This day had plotted, in the council-house
To murder me and my good Lord of Gloucester?"
GLOUCESTER,"What, think You we are Turks or infidels?
Or that we would, against the form of law,
Proceed thus rashly to the villain's death,
But that the extreme peril of the case,
The peace of England and our persons' safety,
Enforced us to this execution?"
GLOUCESTER,"Yet had not we determined he should die,
Until your lordship came to see his death;
Which now the loving haste of these our friends,
Somewhat against our meaning, have prevented"
GLOUCESTER,"And to that end we wish'd your lord-ship here,
To avoid the carping censures of the world."
BUCKINGHAM,"But since you come too late of our intents,
Yet witness what you hear we did intend"
GLOUCESTER,"Go, after, after, cousin Buckingham.
The mayor towards Guildhall hies him in all post"
BUCKINGHAM,"Fear not, my lord, I'll play the orator
As if the golden fee for which I plead
Were for myself"
GLOUCESTER,"If you thrive well, bring them to Baynard's Castle;
Where you shall find me well accompanied
With reverend fathers and well-learned bishops."
BUCKINGHAM,I go
GLOUCESTER,"Go, Lovel, with all speed to Doctor Shaw;
Go thou to Friar Penker; bid them both
Meet me within this hour at Baynard's Castle.
Now will I in, to take some privy order,
To draw the brats of Clarence out of sight;
And to give notice, that no manner of person
At any time have recourse unto the princes."
GLOUCESTER,"How now, my lord, what say the citizens?"
BUCKINGHAM,"Now, by the holy mother of our Lord,
The citizens are mum and speak not a word."
GLOUCESTER,Touch'd you the bastardy of Edward's children?
BUCKINGHAM,"I did; with his contract with Lady Lucy,
And his contract by deputy in France;
The insatiate greediness of his desires,
And his enforcement of the city wives;
His tyranny for trifles; his own bastardy,
As being got, your father then in France,
His resemblance, being not like the duke;
Withal I did infer your lineaments,
Being the right idea of your father,
Both in your form and nobleness of mind;
Laid open all your victories in Scotland,
Your dicipline in war, wisdom in peace,
Your bounty, virtue, fair humility"
GLOUCESTER,Ah! and did they so?
BUCKINGHAM,"No, so God help me, they spake not a word;
But, like dumb statues or breathing stones,
Gazed each on other, and look'd deadly pale.
Which when I saw, I reprehended them;
And ask'd the mayor what meant this wilful silence"
GLOUCESTER,What tongueless blocks were they! would not they speak?
BUCKINGHAM,"No, by my troth, my lord."
GLOUCESTER,Will not the mayor then and his brethren come?
BUCKINGHAM,The mayor is here at hand
GLOUCESTER,"I go; and if you plead as well for them
As I can say nay to thee for myself,
No doubt well bring it to a happy issue."
BUCKINGHAM,"Go, go, up to the leads; the lord mayor knocks.
Welcome my lord; I dance attendance here;
I think the duke will not be spoke withal.
Here comes his servant"
BUCKINGHAM,"Return, good Catesby, to thy lord again;
Tell him, myself, the mayor and citizens,
In deep designs and matters of great moment,
No less importing than our general good,
Are come to have some conference with his grace."
BUCKINGHAM,"Ah, ha, my lord, this prince is not an Edward!
He is not lolling on a lewd day-bed,
But on his knees at meditation;
Not dallying with a brace of courtezans,
But meditating with two deep divines;
Not sleeping, to engross his idle body,
But praying, to enrich his watchful soul"
BUCKINGHAM,"I fear he will.
How now, Catesby, what says your lord?"
BUCKINGHAM,"Sorry I am my noble cousin should
Suspect me, that I mean no good to him"
BUCKINGHAM,"Two props of virtue for a Christian prince,
To stay him from the fall of vanity"
GLOUCESTER,"My lord, there needs no such apology"
BUCKINGHAM,"Even that, I hope, which pleaseth God above,
And all good men of this ungovern'd isle."
GLOUCESTER,"I do suspect I have done some offence
That seems disgracious in the city's eyes,
And that you come to reprehend my ignorance."
BUCKINGHAM,"You have, my lord"
GLOUCESTER,Else wherefore breathe I in a Christian land?
BUCKINGHAM,"Then know, it is your fault that you resign
The supreme seat, the throne majestical,
The scepter'd office of your ancestors,
Your state of fortune and your due of birth,
The lineal glory of your royal house,
To the corruption of a blemished stock"
GLOUCESTER,"I know not whether to depart in silence,
Or bitterly to speak in your reproof.
Best fitteth my degree or your condition
If not to answer, you might haply think
Tongue-tied ambition, not replying, yielded
To bear the golden yoke of sovereignty,
Which fondly you would here impose on me;
If to reprove you for this suit of yours,
So season'd with your faithful love to me.
Then, on the other side, I cheque'd my friends.
Therefore, to speak, and to avoid the first,
And then, in speaking, not to incur the last,
Definitively thus I answer you.
Your love deserves my thanks; but my desert
Unmeritable shuns your high request.
First if all obstacles were cut away,
And that my path were even to the crown,
As my ripe revenue and due by birth
Yet so much is my poverty of spirit,
So mighty and so many my defects,
As I had rather hide me from my greatness,
Being a bark to brook no mighty sea,
Than in my greatness covet to be hid,
And in the vapour of my glory smother'd.
But, God be thank'd, there's no need of me,
And much I need to help you, if need were;
The royal tree hath left us royal fruit,
Which, mellow'd by the stealing hours of time,
Will well become the seat of majesty,
And make, no doubt, us happy by his reign.
On him I lay what you would lay on me,
The right and fortune of his happy stars;
Which God defend that I should wring from him!"
BUCKINGHAM,"My lord, this argues conscience in your grace;
But the respects thereof are nice and trivial,
All circumstances well considered.
You say that Edward is your brother's son"
BUCKINGHAM,"Refuse not, mighty lord, this proffer'd love."
GLOUCESTER,"Alas, why would you heap these cares on me?
I am unfit for state and majesty;
I do beseech you, take it not amiss;
I cannot nor I will not yield to you."
BUCKINGHAM,"If you refuse it,--as, in love and zeal,
Loath to depose the child, Your brother's son;
As well we know your tenderness of heart
And gentle, kind, effeminate remorse,
Which we have noted in you to your kin,
And egally indeed to all estates,--
Yet whether you accept our suit or no,
Your brother's son shall never reign our king;
But we will plant some other in the throne,
To the disgrace and downfall of your house"
GLOUCESTER,"O, do not swear, my lord of Buckingham."
GLOUCESTER,"Would you enforce me to a world of care?
Well, call them again. I am not made of stone,
But penetrable to your. kind entreats,
Albeit against my conscience and my soul.
Cousin of Buckingham, and you sage, grave men,
Since you will buckle fortune on my back,
To bear her burthen, whether I will or no,
I must have patience to endure the load"
GLOUCESTER,"In saying so, you shall but say the truth."
BUCKINGHAM,Then I salute you with this kingly title
BUCKINGHAM,To-morrow will it please you to be crown'd?
GLOUCESTER,"Even when you please, since you will have it so."
BUCKINGHAM,"To-morrow, then, we will attend your grace"
GLOUCESTER,"Come, let us to our holy task again.
Farewell, good cousin; farewell, gentle friends."
DUCHESS OF YORK,"Who meets us here?  my niece Plantagenet
Led in the hand of her kind aunt of Gloucester?
Now, for my life, she's wandering to the Tower,
On pure heart's love to greet the tender princes.
Daughter, well met."
QUEEN ELIZABETH,"As much to you, good sister! Whither away?"
QUEEN ELIZABETH,"Kind sister, thanks"
QUEEN ELIZABETH,"The king! why, who's that?"
QUEEN ELIZABETH,"The Lord protect him from that kingly title!
Hath he set bounds betwixt their love and me?
I am their mother; who should keep me from them?"
DUCHESS OF YORK,I am their fathers mother; I will see them.
QUEEN ELIZABETH,"O, cut my lace in sunder, that my pent heart
May have some scope to beat, or else I swoon
With this dead-killing news!"
QUEEN ELIZABETH,"O Dorset, speak not to me, get thee hence!
Death and destruction dog thee at the heels;
Thy mother's name is ominous to children.
If thou wilt outstrip death, go cross the seas,
And live with Richmond, from the reach of hell
Go, hie thee, hie thee from this slaughter-house,
Lest thou increase the number of the dead;
And make me die the thrall of Margaret's curse,
Nor mother, wife, nor England's counted queen."
DUCHESS OF YORK,"O ill-dispersing wind of misery!
O my accursed womb, the bed of death!
A cockatrice hast thou hatch'd to the world,
Whose unavoided eye is murderous."
QUEEN ELIZABETH,"Go, go, poor soul, I envy not thy glory
To feed my humour, wish thyself no harm."
QUEEN ELIZABETH,"Poor heart, adieu! I pity thy complaining."
QUEEN ELIZABETH,"Farewell, thou woful welcomer of glory!"
DUCHESS OF YORK,""
QUEEN ELIZABETH,"Stay, yet look back with me unto the Tower.
Pity, you ancient stones, those tender babes
Whom envy hath immured within your walls!
Rough cradle for such little pretty ones!
Rude ragged nurse, old sullen playfellow
For tender princes, use my babies well!
So foolish sorrow bids your stones farewell."
KING RICHARD III,Stand all apart Cousin of Buckingham!
BUCKINGHAM,My gracious sovereign?
KING RICHARD III,"Give me thy hand.
Thus high, by thy advice
And thy assistance, is King Richard seated;
But shall we wear these honours for a day?
Or shall they last, and we rejoice in them?"
BUCKINGHAM,Still live they and for ever may they last!
KING RICHARD III,"O Buckingham, now do I play the touch,
To try if thou be current gold indeed
Young Edward lives"
BUCKINGHAM,"Say on, my loving lord."
KING RICHARD III,"Why, Buckingham, I say, I would be king,"
BUCKINGHAM,"Why, so you are, my thrice renowned liege."
KING RICHARD III,Ha! am I king? 'tis so
BUCKINGHAM,"True, noble prince."
KING RICHARD III,"O bitter consequence,
That Edward still should live! 'True, noble prince!'
Cousin, thou wert not wont to be so dull"
BUCKINGHAM,Your grace may do your pleasure.
KING RICHARD III,"Tut, tut, thou art all ice, thy kindness freezeth"
BUCKINGHAM,"Give me some breath, some little pause, my lord
Before I positively herein"
KING RICHARD III,"I will converse with iron-witted fools
And unrespective boys"
KING RICHARD III,"Know'st thou not any whom corrupting gold
Would tempt unto a close exploit of death?"
KING RICHARD III,What is his name?
KING RICHARD III,I partly know the man
KING RICHARD III,Catesby!
KING RICHARD III,"Rumour it abroad
That Anne, my wife, is sick and like to die"
KING RICHARD III,"Art thou, indeed?"
KING RICHARD III,Darest thou resolve to kill a friend of mine?
KING RICHARD III,"Why, there thou hast it"
KING RICHARD III,"Thou sing'st sweet music. Hark, come hither, Tyrrel
Go, by this token"
KING RICHARD III,"Shall we hear from thee, Tyrrel, ere we sleep?"
BUCKINGHAM,"My Lord, I have consider'd in my mind
The late demand that you did sound me in."
KING RICHARD III,"Well, let that pass. Dorset is fled to Richmond."
BUCKINGHAM,"I hear that news, my lord."
KING RICHARD III,"Stanley, he is your wife's son well, look to it."
BUCKINGHAM,"My lord, I claim your gift, my due by promise,
For which your honour and your faith is pawn'd;
The earldom of Hereford and the moveables
The which you promised I should possess."
KING RICHARD III,"Stanley, look to your wife; if she convey
Letters to Richmond, you shall answer it."
BUCKINGHAM,What says your highness to my just demand?
KING RICHARD III,"As I remember, Henry the Sixth
Did prophesy that Richmond should be king,
When Richmond was a little peevish boy.
A king, perhaps, perhaps,--"
BUCKINGHAM,My lord!
KING RICHARD III,"How chance the prophet could not at that time
Have told me, I being by, that I should kill him?"
BUCKINGHAM,"My lord, your promise for the earldom,--"
KING RICHARD III,"Richmond! When last I was at Exeter,
The mayor in courtesy show'd me the castle,
And call'd it Rougemont"
BUCKINGHAM,My Lord!
KING RICHARD III,"Ay, what's o'clock?"
BUCKINGHAM,"I am thus bold to put your grace in mind
Of what you promised me."
KING RICHARD III,"Well, but what's o'clock?"
BUCKINGHAM,Upon the stroke of ten.
KING RICHARD III,"Well, let it strike."
BUCKINGHAM,Why let it strike?
KING RICHARD III,"Because that, like a Jack, thou keep'st the stroke
Betwixt thy begging and my meditation.
I am not in the giving vein to-day."
BUCKINGHAM,"Why, then resolve me whether you will or no."
KING RICHARD III,"Tut, tut,
Thou troublest me; am not in the vein."
BUCKINGHAM,"Is it even so? rewards he my true service
With such deep contempt made I him king for this?
O, let me think on Hastings, and be gone
To Brecknock, while my fearful head is on!"
